Review,Rating
"В магазине долго тестила iPhone 6 и iPhone 6+, но довольно быстро поняла, что 6+ слишком огромен.Прелесть 5s была в том, что при стандартном положении телефона в руке можно было легко дотянуться одним пальцем до любого участка экрана. На 6+ сделать это невозможно, да и на просто 6 затруднительно. Второй ""айпад"" мне точно не нужен, поэтому остановилась на 6ке.iOS работает без нареканий.Батарею держит лучше, чем на предыдущей модели. Провели эксперимент. Одновременно зарядили 6-ку и 5s до 100%. Пользовали одинаково (включая авиа-режим, интернет, вайфай, аймесседж и пр.). Через 13 часов у 5s осталось 19%, у 6ки — 56%. Впрочем, при пользовании скайпом в фоновом режиме, да еще и с навигатором — зарядка сжирается очень быстро, так что все равно зарядить телефон утром и уйти на весь день, забыв зарядку, едва ли получится.В целом покупка 6ки полностью отменила необходимость во всяких айподах-айпадах. 64гб — достаточно, чтобы спокойно слушать музыку. Экран позволяет и кино смотреть, если очень надо. Для меня связка эйр + айфон6 теперь идеальна, и никаких других гаджетов больше не надо.Как было сказано выше, советую приобретать пленки на экран и чехлы. До этого я использовала 5s в чехле и пленке. Для продажи сняла и то, и другое, и состояние после полугода использования было идеальное, хотя на пленке было очевидно, как сильно она царапается.",5
"Бесит, что защитные стекла все идут не на весь экран а по краям значительное расстояние идет из-за скошенных углов;(Батарею бы хотелось помощнее, увы она в шестерке тоже не фонтан. Желательно чехол сразу да такой, чтоб все углы защищал, а то алюминиевый корпус царапается в два счёта и при падении и при носке в кармане с ключами;))",5
"Мой отзыв будет полностью критичен, или даже не критичен а отзыв который опишет все что мне не понравилось так как предыдущие смотрю только расхваливают не побоюсь этого слова чудо техники.",3
"приобрел в замен своему 3GS. Телефоны меняю очень редко но на замене не экономлю. Да, интересная модель но по моему мнению слишком великоват, но поскольку часто использую телефон как навигатор, размер экрана скорее достоинство. Тонкий - это достоинство и недостаток одновременно. Очень скользкий, пару раз чуть не упал, обязательно купите чехол!  В остальном обычный телефон с вылизанным интерфейсом. Все работает гладко и без нареканий, программы открываются почти мгновенно. Так же они у меня когдато открывались на новом 3GS, но время идет... Качество сборки, как обычно, идеальное. Телефон у меня серого цвета с белой лицевой поверхностью.В общем хороший телефон, много приложений и игр, удобен в работе, отличный музыкальный плеер и навигатор, идеально вписывается в мою ""яблочную корзину"" устройств, но... если бы не iMac и ipad 3 и привычка пользоваться Mac OS X,  а нужен был бы просто хороший телефон - я бы купил Blackberry!!!",4
"Телефон хороший. Если вы в основном звоните, то это ваш вариант. Для меня самый большой минус это его ОС. Базовые функции не отличаются от большенство современных телефонов, но с их расширениями большая беда.",4
"В целом трубой доволен. Техникой apple пользуюсь давно, врать не буду, очень люблю i-девайсы. Прочитал много отзывов здесь про эту модель от владельцев ведроидов и сделал вывод. 1. Те кто гонят на батарею - у ведроидов есть батареи по 4-5к мАч, а толк ? Ну не день, а два будет держать. Телефон в ширине увеличивается правда при большом объеме батареи. 2. 16gb не нравится ? Купите на 64 или 128. Дорого стоит ? Купите ведроид и довольствуйтесь лагами, багами, дырами и взломами со стороны хакеров, зато система открытая у ""Андрюши"", не то что у i-девайсов. По поводу того, что заявлено 16гб, а по факту 11 с копейками - попал один раз мне в руки ведроид на 4 гб памяти, так вот, операционка занимала чуть больше 2х гигов, так что разница не велика. Почему нет флеш-карт в i-девайсах ? Потому что компании apple дико не нравятся дыры(слоты) под флешки, симки и т.д. Они даже в своё время хотели сделать универсальные, встроенные сим-модули, чтобы убрать слот под сим. И вот сейчас они упорно занялись этой разработкой, кстати совместно с самсунгом.i-девайсы - это дело для ценителей качественно собранной техники, без скрипов корпуса и т.д. Цена не дорогая, учитывая например йотафон 2 или самсунг с6 или с6 эдж. Это моё мнение. Занавес.",5
В целом для звонков общения и поддержки эпл как бренда - пойдёт .. если нужны мультимедийные задачи и возможности берите на 64..эта модель не совсем удачная.,4
"Рекомендую к покупке. Лучший смартфон на рынке без вариантов. Если бы не выросшие курс доллара и евро, то стоил бы он сейчас порядка 24000₽ или того меньше ($650 - рекомендуемая цена в США без налога).",5
Ужас просто сижу я такая в телефоне 40 процентов зарядки вырубился боже еще не включался я испугалась поставила на зарядку не заряжал. Потом начал заряжать взяла я его и обожглась . Заряда горячая пипец .,2
"Долго был владельцем Iphone 4. Когда тот начал загибаться встал перед выбором нового телефона. Выбор был между 5s и 6. 5s модель с виду более надежная и проверенная за год, да и цена на момент покупки была ниже 6й на 9 тысяч. Да и форма старая мне нравилась больше.в 6ке пугал непривычно большой размер, легкость и кажущаяся ненадежность аппарата. Да и торчащая камера не придает ему притягательности. И все-таки решил взять модель новее с расчетом на длительное использование. Первым делом одел в чехол - аппарат сразу стал казаться надежнее. Стекло и камера теперь не выпирают.По прошествии пары месяцев скажу, что телефоном доволен на все 100%. Казавшийся большим размер теперь кажется оптимальным - беру свою четверку с полки и не понимаю как пользовался таким маленьким экраном. Те кого смущает размер не бойтесь - он очень удобен в руке - у меня получается  его использовать одной рукой без перехватов.  И держать его округлые формы тоже очень приятно.Корпус пока не гнется, не мнется, хотя ронял и ношу в узких джинсах - так что за целостность аппарата не бойтесь. Аккумулятор работает на ура - стал заметно больше - у меня держится до 3х дней при средней загрузке(телефон, мессенджеры, почта, музыка).Что смущает, так это оператива -  в battery doctor видно, что даже в рабочем режиме оператива забита на 80%. Как ни странно все работает очень быстро. На порядок быстрее 4-й модели и немного быстрее 5s (сравнивали со знакомыми). Единственным последствием ограниченности оперативки будет то, что система не будет держать в активном состоянии много вкладок браузера или запущенных приложений.Хочется дополнительно отметить отличное качество связи  - хороший динамик и антенна позволяют разговаривать даже в переходах и метро  (прошлый у меня сеть терял).Также порадовал новый GPS - хватает позицию очень быстро, притом даже в здании (прошлый не делал) - это очень удобно когда нужно в пробке срочно выставить маршрут. Вобщем кто сомневается  - берите - телефон отличный",5
"От этого телефона одни отрицательные эмоции, я не советую никому.",1
"Приобрёл в 2014г. Декабрь. Телефоном доволен на 65%-70% примерно. До этого был Iphone 5, 3GS, Samsung Genio, Nokia 6262, ну и первый телефон как и у всех Nokia 3310",3
"до этого обладал многими телефонами,из яблок больше чем 4s мне ничего не понравилось.не буду углубляться в проблемы с осью и синхронизацией,у нее и плюсы есть но все же 6кой я огорчен.удивляет как люди пару лет назад смеявшиеся над всем более 4 дюймов ву-аля лопата считают сейчас это и 6 плюс удобным.врать не буду при покупке руководствовался лишь тем что он всего навсего новее любого другого яблока.отдал сестре,гоняю с Sony Xperia Z3,более доволен...очень жду nexus 6 , надеюсь моторола с гуглом не оплошали",2
"Айфоны я люблю всем сердцем, раньше пользовалась четверкой, а потом перешла на шестерку. Честно говоря, довольна всем. Телефон стильный, удобно лежит в руке, хотя на первый взгляд может показаться, что он несколько громоздкий. Жалею, что взяла всего на 16 гигов, памяти катастрофически не хватает. Еще не радует, что он мгновенно вырубается даже при плюсовой температуре. Если на улице плюс три, телефону становится холодно и включить его становится возможным только поставив на зарядку. В остальном модель отличная, пользоваться одно удовольствие",5
"Раньше был Samsung Galaxy Alpha SM-G850F 32Gb, купил Iphone 6 16 Gb, экран подходящий, но на Iphone 6 мало памяти для такой цены. Для комфорта лучше взять 64 Gb. Прилично греется в играх. Понравился сенсор отпечатков. Работает очень хорошо.  В совокупности характеристик и возможностей реальная цена ему 20-25 тыс. Но никак не 32. В целом рекомендую к покупке, но сначала проверьте себя на apple-совместимость, взяв любой телефон от apple у друзей или знакомых.",4
"Самый совершенный аппарат, на мой взгляд, на сегодня из доступных на рынке. Разумеется он и должен быть таким за эту цену ))) Фото, вне конкуренции...специально с самсунгом  S 5 сравнивал в условиях полумрака. Хотя у него 16 Мп заявлено, а у iPhone - 8, так что не верьте тому, кто утверждает обратное или попробуйте сами сравнить, если будет возможность. Выпирающий объектив,выпирает меньше чем на Samsung 6S. У меня в чехле он скрыт совершенно. Аккум держит сутки и более..с включенным wifi и при среднем юзаньи..у кого плохо с аккумом, то надо прокачивать изначально.  Шустрый, ни разу не заглючил...качество звука отличное. Тонкий, элегантный. Раньше недооценивал iPhohe, думал что реально цена за БРЭНД  )))  У самого до айфона и самсунги и эксперии и лыжи и ZTE c Huawey и Хайскринами и HTC были, всё это хлам и одноразовые безделушки, я посчитал, сколько я на них денег перевёл, меняя каждые пол года или по причине поломки или просто устаревали быстро или разбивал, так понял, что лучше реже, но айфон ...сейчас у моей жены iPhone 5S, iPad и однозначно.....следующие будут iPhone 7...если войны с Америкой не будет )))",5
Не советую брать эту модель.,2
"Первый айфон, до этого были только айпады и айподы, ну и телефоны на андроид. Обратно не вернусь - не стоят эти финтифлюшечки беспроблемной работы всего и вся, особенно в связке нескольких устройств. Батарея держит до ночи стабильно, в режиме 3G вестимо дольше чем с включенным LTE, никаких толстых рамок у него нет, рабочая поверхность экрана занимает 100% площади дисплея, в отличие от андроидфонов, цвета для глаз приятные, шрифты - четкие, отклик приложений - мгновенный. А уж как приятно держать в руках! В цвете space gray - просто произведение искусства, создается впечатление монолитной конструкции в руке, с закругленными гранями смотрится весьма элегантно. Я влюблена)) Нравится - берите и не думайте",5
"да дорогой, по сравнению с другими тел за эту цену железо слабое, но мне оч нравится и я не жалею денег, главное себя порадовать, это стоит денег , мы живем в мире потребительства , так что это все нормально)советую тем кому не жалко денег на красивый и приятный Эпл!",4
Айфон уже не тот.,3
"Аппарат хороший, если Вы не считаете каждую копейку, можете позволить - берите. Те, кто весь в яблоке или хотя бы с планшетом, тем более. Если тяжело, то наверно нет смысла.",5
"Отличнейшая камера. Шустрая операционная система. Всякие GPS-акселерометры-компасы и прочее работают выше всяческих похвал, быстро и так, как надо. Приятный на ощупь, хотя немного скользкий - без бампера не обойтись. Хорошая цветопередача и углы обзора. Сканер отпечатка - реально удобно, оказывается! Качественное воспроизведение музыки - в нормальных наушниках. Отличный прием. LTE, в том же скайпе разговаривать - одно удовольствие. Емкая батарея. Огромное, просто нереально огромное количество аксессуаров и дешевых запчастей. Защита от кражи путем блокировки - лучше это, чем совсем ничего.",5
"Поменял свой 4S на 6ку. За неделю привык к большому размеру. Теперь ни 4S, ни 5ками пользоваться жутко не удобно.Кратко о достоинствах:1) Внешний вид устройства выигрывает у всех смартфонов на Android;2) Большое количество качественных приложений на все случаи жизни;3) Камера снимает отличное видео и фото, даже в темное время суток.Кратко о недостатках:1) Покупал версию на 64Гб за 36,990 в официальном магазине. На старую цену я могу найти для себя преимущества, но за 46,990 пока еще можно купить два достойных смартфона на Android;2) Первый раз попалась продукция Apple с браком. Брак заключается в микронеровности на стекле. Если экран кристально чистый, то все отлично. Стоит ему слегка заляпаться - появляется небольшое пятно над динамиком, которое стирается только специальными тряпочками.",4
"за 10 часов использования - музыка утром, смс/звонки/виберы/контакты и прочие мессенджеры в течение дня, игры и серфинг в интернете на 4 G заряд израсходован 40% из 100. это действительно весомо, по сравнению с 4 s, который к обеду уже требовал подзаряда. интернет действитель шустрый - вай-фай и 4G просто летают.большой экран просто завараживает! после 4s весьма ощутима разница буквально в каждой мелочи.дизайн, как бы его не ругали, приятный во всех проявлениях. очень довольна приобритением! успела купить до подорожания, цена сейчас какая-то нереальная, 47 тысяч это перебор, ну каждый сам решает - стоит он того или нет",5
"Аппарат очень интересный, как по функционалу, так и по внешнему облику. Благодаря стабильной работе системы, камере, производительности практически оправдывается высокая цена.",5
"Вообщем как то раньше айфон был лучше, была магия, не было тонны багов, реально имела смысл переплата. Сейчас это просто телефон с хорошим дизайном и интеграцией в экосистему apple. Второй аппарат на android и выглядит во многих аспектах поинтереснее. Но тем не менее пользоваться приятно.",4
"нормальный взрослый гаджет и надо понимать , что это игрушка для взрослых. а функции телефона может и выполнять аппарат и за 1000 рублей.Вопрос в том, что  можете ли вы сами раскрыть потенциал смартфона , или просто купить для понтов.  Изящный , тонкий , надежный аппарат.",5
