Review,Rating
"Рукоплещу разработчикам и самому MultiPhone 4055. Реально, за такие деньги я получил качественный, достойный, двухсимочный аппарат. Все на высоте, и дизайн, и скорость работы, и андроид стоит. Без тормозов и лагов. Очень доволен покупкой.",5
После закачки дополнительных программ этот прибор становится монстром на учебе,4
С корпусом надо поработать.,4
"на самом деле не сильно отличается от предшественника в лице Prestigio MultiPhone 4044, разве что наличием более крутого граф процессора. А так плюсы все те же - быстрый двухядерный проц, не позволяющий зависать система почти ни при каких обстоятельствах. Хорошая камера. наличие двух симслотов, отличный экран с хорошей цветопередачей. Игры зато идти быстрее будут",4
"Хороший телефон. Батарею не считаю недостатком, т.к. это косяк всех андроид-фонов. Приятно лежит в руке, создает ощущение дорогого телефона. Большой экран с сочными красками. Игры идут хорошо (""angry birds"" и 'fruit ninja""), не тормозят. В общем адекватный такой работяга за свою цену.",5
"После прочтения отзывов были некоторые сомнения брать или нет. К счастью, большинство недостатков, указанных в комментариях обошли мой телефон стороной.Никаких скрипов задней панели, отлично ловит сеть (билайн и МТС), хороший звук (никаких шумов во время разговора), баланс легко проверяется на любой из сим-карт, батареи хватает.Что особенно радует - экран 4 дюйма, прибавил телефону в ширине всего 2 миллиметра против телефонов с диагональю  экрана 3.7. Модели с аналогичным экраном у других производителей уже начинают напоминать ""лопату"".Единственно нельзя сказать, чтоб он летал. Для меня это не критично, но для кого-то может быть важным параметром.",4
"Двухсимочных телефонов очень мало, так что в целом выбирать не из чего. А из того, что есть это, пожалуй, лучший вариант. Хотя с главной своей функцией телефон таки не справился...",3
"Телефон не брать!Пишу подробно:1. Медленный!!Сравнивали с айфоном 3gs. Айфон - старая модель, так а работает в 2 раза плавнее, намного быстрее, OS удобнее. Этот же, HTC, еле ползает со своим 1-ядерным 1-гигагерцовым процессором. Посмотреть страничку в интернете - проблема. Пока он ее подгрузит или покажет - хочется телефон вообще выключить.2. С 2-я симками работает отвратительно!Всегда были телефоны Самсунги (2-х симочные) и LG (3-х симочный). Так эти как многосимочные телефоны - идеальны! HTC - как 2-х симочный - ужас в ночи! Кнопок механических у него нет, все надо выбирать на экране, так постоянно ошибаешься и тыкаешь не в ту симку (что бы позвонить). В итоге запалил свой 2-ой секретный номер :( С 2-х симочным самсунгом на протяжении года такого ни разу не случилосьЛегкое прикосновение к экрану могут вызвать неконтролируемый набор номера.3. Просто тупо глючит. А что глючит - непонятно!Поехал на встречу. Надо было срочно сделать звонок. Звоню, а этот Desire V не звонит... Тыкаю 2, 3, 4, 5-ый раз - не звонит! Сбрасывает и все. Почему? не понятно... Взбесило так, что сел в машину, расковырял его, воткнул симку в LG за 2000 рублей и просто позвонил.4. GPS постоянно теряет спутники. Еду по Каширке, застроек нет, пытаюсь найти адрес, так GPS постоянно вылетает из Яндекс-навигатора. Каждые 2 минуты вылетает. А когда находит снова, то на другом конце Москвы позиционируется, хотя я метров 20 отъехал вперед. Это пипец! Я еле доехал до нужного адреса. Раньше ездил по планшету Galaxy TAB 10.1. Так там и Яндекс-навигатор и само GPS в легкую и идеально работают!5. Батарея разряжается здорово, а так как говорю я очень много, то это реальная проблема.Вообщем этот аппарат не рекомендую!!",2
"отработал 2 года без проблем, потом перестал смс отправлять, а через два месяца выключился и все. в СЦ сказали сгорела микросхема памяти, ремонт не целесообразен.жаль, хороший тлф.",3
Купили в фирменном магазине HTC в Санкт-Петербурге. Может от этого качество зависит,5
"Ну сообственно распишем все как есть. Звук(sony mdr-xb200), и басит, и запас есть, но нужно копатся в сторонних плеерах в эквалайзере. Из всешнего динамика звук ужасен. Настраивай не настраивай, эфекта нет. Но будильник слышно, и ладно, неплохо. Дизайн(фирменный из линейки Desire) красив, показать не стыдно, в штанах не топорщится. Экран, да, superLSD никакой кислоты от амоледа, цвета сравнительно сочные, соотношение сторон хорошее. Анрюша, четверка, выше не анонсируют вроде. А теперь минусы. Экран, пусть марок, пусть на солнце иногда невидно, но gorilla glass поймал на себе трещину, маленькая, больше, больше. И однажды достав переключить трек увидел крупную такую трещинку от разговорного динамика к левому краю тела. Разачаровало, может сам где поймал. Батарея. Тихое, нежное существо, как и любое нежное существо выдыхается быстро, часа 4 музыки, пару смс-ок пару звонков, минут 40 в интернете через 3гы. К концу дня просится к тить... розетке, пожирать электричество. Кстати имеет тенденцию греть cpu при длительной работе в интернете, ну или фильмы там.Железяка в тельце данного чудища... Оно такое... 512мб Ram. 1 Гигагерц. 1 ядро. Очень мало, имеет привычку зависать в меню, звонках, игрульках. В целом терпимо, не часто виснет но виснет, таск киллер в лапки.Вообщем. Решайте сами, довольно крупные плюсы звук(ручками эквалайзеры крутим), экран, довольно живой, ну и андюшка, пусть не 4.12Минусы, батарея, не долгоживущая, железо, слабоватое для нашего времени(эгегей! китайцы за копейки могут и копию гнусмаса галактического запилить с таким же железом). В моем случае экран. Треснул, по гаранти не заменили, а  в сц попросят дорого (6/8 тысяч рублей), проще новое тело купить, или заказать дигитайзер на ebay.com оригинальный. Тело слетает с гарантии но стоит замена горилы намного дешевле.",3
"Пользуюсь им меньше года. Постоянно тормозит, лагает страшно. Нету фронтальной камеры, сборка ужасная",3
"Спустя 5-6 месяцев использования отключился и перестал работать. Отдала в ремонт по гарантии, отремонтировали. Прошло 8 месяцев после ремонта - до сих пор все хорошо работает, несмотря на многочисленные падения, мороз и тд))",4
"Владел данным аппаратом 9 мес.Это уже 3-й HTC у меня (первые 2 до сих пор живы и прекрасно себя чувствуют в др руках).Телефон устраивал абсолютно всем моим требованиям, был рабочей лошадкой: более 30 звонков в день, интернет, навигация.Замечательно работали Wi-fi, блютуз, GPS.При достаточно интенсивном использовании заряда всегда хватало на 2 дня.С 2-мя симками проблем не было. На первой личная с интернетом, на второй рабочая. Активная в момент разговора только одна. Но это не минус, т.к. экономится энергия, а по пропущенным контактам всегда придет СМС.Камера снимала так же достаточно неплохо.Сфоткать быстро интересный момент, заснять расписание, скопировать и отправить документ - для всего этого хватало.Недостатки надежности стали проявляться на 6-й месяц эксплуатации, без конца сам перезагружался, стали плохо работать все кнопки, без конца терял интернет - пока не перезагрузишь, навигация висла и вылетала...С вещами обращаюсь очень аккуратно, данные проблемы не зависели от условий эксплуатации.Последней каплей, переполнившей терпение, стала подсветка: на блокировке внизу экрана горит, снимаешь блокировку вверху экрана подсветка загорается, внизу не горит.Пошел и сдал телефон назад, вместе с заявлением о расторжении договора купли продажи... не сразу конечно, и не без проблем,  но деньги в полном объеме назад получил.Меньше чем за год телефон подешевел в 2 раза.Очень хочется надеяться, что мне достался не удачный экземпляр НТС... т.к. до данного аппарата являлся поклонником HTC, а сейчас не знаю что и думать...Сейчас купил Катерпиллер Б15. Очень доволен - брутальный, крепкий телефон, с функционалом получше этого.",4
"Телефоном крайне не доволен, жалею что купил,3 дня ловил gps часами бродя по улице, тормоз такой что иногда хочется звякнуть его об стену, кнопки со второго раза кое как срабатывают, все еле еле движется (у соседа desire s все летает а тут полный тормоз), со второй симки вечно не дозвониться. Крайне не советую брать!",1
"На момент покупки - в 2012 году - смартфон этот только вышел и стоил что-то около 16 т. р. Все эти годы служил мне верой и правдой. Ни разу не ломался, хотя роняла на пол я его множество раз. Сейчас уже с ним имеются некоторые проблемы, которые возникают как раз из-за небольшого объема внутренней памяти, приходится постоянно подчищать кэш, иначе начинаются ""глюки"" (сам нажимает на экран, либо проблемы с инстаграмом, а именно с новыми его версиями, с первыми версиями проблем никогда не было). Малыш попросту уже не тянет постоянно обновляющиеся версии программ. Несколько раз я обновляла его до заводских настроек. Еще нюанс - заедает кнопка блока клавиатуры, расположенная сверху. Но и этот дефект появился уже со временем, мне особых хлопот не доставляет, уже привыкла.Итог такой: если вы не нуждаетесь в установке большого количества программ, а также хранении большого количества информации в памяти телефона, эта модель вполне может вас удовлетворить. Хотя, кажется, в продаже ее нынче уже нет. Во всяком случае этот отзыв точно в пользу HTC - среди своих знакомых я не встречала людей, пользовавшихся одним и тем же смартфоном на протяжении стольких лет.",5
"Телефон у меня почти год, второй раз отдал в ремонт по гарантии, первый раз заменили модуль дисплея, щас уже второй раз отдал в ремонт, у знакомых у кого была такая модель, в итоге списали в брак, лучше не покупать данную модель!!!",2
"Опыт использования более года. Купил из за двух сим карт. Ни разу не пожалел. Рабочая лошадка. Падал и с высоты и в воду, но ничего работает дальше, никаких изменений не произошло, вовремя достал батарею. Камера слабовата. Но это  не критично. Батареи при активном использовании еле хватает на день. Зарядка должна быть всегда под рукой. Комп спокойно определяет как флешку. Экран устойчив к царапинам. Сначала был защищен пленкой. но потом стал обходится и без нее нормально. Для игр слабоват. Да и экран маловат.",4
"С момента выхода НТС touch diamod был ярым поклонником маркидо сих пор считаю что даймонд и дезайр с самые неубиваемые телефоны, чего они только не испытывали у меня, и выпадение из кармана с мотоцикла на скорости за двести, и аварию на машине когда ударился об дверь ребрами через телефон, ребра целы телефон согнулся в букву C и работает дальше, плавали в воде, играл ребенок всё пофик, первый сломал сам когда решил поменять дисплей с корпусом второй работает до сих пор в режиме пульта от телека и для скайпа. Купил дезайр в и блин так разочарован что хочется бросить его оп стену, недостатки перечислил, особенно издевательством видятся постоянное предложение отправить отчет о сбое системы в НТС но никаких исправлений не предвидится судя по всему проблема решается отключением 3Г но вопрос зачем мне тогда телефон который н может рабоать с 3г нормально?, самое обидное, что сдать его назад не получиться так как сервисный центр просто переустановит андройд скорее всего и скажет что все ок, времени на это нет и желания тоже возможно что проблему с перезагрузкой еще как то можно решить самостоятельно но желания даже искать нет есть желание чтобы он совсем сломался и выкинуть его. марка НТС для меня больше не существует!",1
Взял этот телефон так как разбил экран на Samsung gt-n7000. Был выбор взял Highscreen Blast но он зараза выключается сам! HTC Desire V оказался порядком дороже. Но оказывается у него есть сквозное подключение интернет к компьютеру подключил и качай что хочешь на HTC! Но это еще не всё. При сквозном подключении к компьютеру на котором есть интернет смартфон может ещё работать и как wi-fi роутер что вообще замечательно т.к. у меня ноут берет Wi-Fi скорость замечательная! Слабая начинка и подтормаживает но это всё пустяки для меня т.к. Wi-Fi роутер это чтото с чемто неповторимое! Первый раз увидел чтоб на смартфоне была такая опция! Было очень много телефонов менял их как параноик но этот просто удивил по своим возможносям!,5
"Вообщем я разочарован, накоплю денежков и куплю другой аппарат.",2
"За свои деньги телефон реально неплохой, две сим карты, удобное меню, батареи хватает больше чем на двое суток, и то до конца разряжать неполучалось, флешку на 32гб читает на ура, не тупит, в целом телефон достойный!",4
"Юзал его около года. Долго искал замену.Приобрел Philips w832 - тоже двухсимочник, но звонит, в отличие от нтс он гораздо стабильнее.",2
"Многие недостатки, описанные предыдущими людьми, в действительности не значительны. В любом телефоне их полно. Но есть недостатки переходящие из отзыва в отзыв. И этот отзыв - не стабильная связь! Задумайтесь, если хотите оставаться на связи. Внимательно читайте отзывы и обращайте внимание на опыт использования. Первые 2 месяца я его в кнопки целовала и продолжала бы, если бы мне не его сбои.",3
"Это мой первый смартфон и первое что стало раздражать несоответствие цены в 15 990р., и качества продукта. Как телефон вполне приемлем, но почему нельзя было в настройках, сделать разными сигналы смс, для разных сим карт, их всего то две? Если активен интернет, то вторая симка недоступна, а интернет серфинг просто мучение. Фото получается как в фотошопе, голова одного, а туловище другого человека, цвета крикливые и неестественные. Но было и хорошее, оффлайновый навигатор прилежно водил 3 500 км до моря и обратно, все мои контакты синхронизированы в аккаунте гугл и теперь надеюсь не пропадут при смене телефона. Мои негожие фото с камеры, так же сохранятся в сети. Когда садишься в машину, аппарат через блютуз, сам подключается к медиасистеме и буде нормальным интернет, можно было бы, слушать интернет радио. Когда придет время менять, наверное не выберу телефон HTC.  Вот пришло время прощаться со стариком, который прослужил мне почте 3 года и хотя он последнее время быстро разряжался и зависал порой, все же мне его жаль. Для своего времени он был неплохим аппаратом.",3
"Результатов пока не знаю, хожу без телефона вообще...",2
"После 6 месяцев использования стал ежедневно перезагружаться, ярлыки приложений, установленных на карту памяти стали после этого исчезать. Смартфонами на андроиде раньше не пользовался, поэтому хочу сказать про батарею - при обычном использовании (немного разговоров, интернета, музыки) заряда батареи хватает максимум на сутки, а если немного активнее начать пользоваться, то и до вечера заряда не хватит. В общем кабель для его зарядки таскать с собой лучше всегда. Если данной модели добавить немного мозгов и заряда батареи и оставить ту же цену, то она бы меня полностью устраивала, а так планирую брать другой двухсимочник.",3
