Review,Rating
"Выбирала его благодаря отзывам здесь, поэтому решила написать свой. Пользуюсь им пять месяцев. Внешне не видоизменился, никаких потертостей, стараюсь носить в чехле, который был с ним в комплекте, гарнитура тоже порадовала, звук громкий и довольно объемный. Это мой первый сенсорный телефон и первый телефон на андроиде и я им, в общем-то, довольна. Какие были у меня с ним проблемы: 1) Однажды, через пару месяцев после покупки, внезапно перестал воспринимать карту памяти, требуя ее отформатировать. Карта 16Гб. С картой все в порядке, она не ломалась, не намокала...После форматирования продолжаю ей пользоваться; 2) Глухой и тихий голос звонящего(как ""из валенка""). Вылечила почти сразу через инженерное меню;3) Вообще, сначала было сложновато открыть крышку телефона, и самое что неприятное, после открытия батарея сразу вываливается, совершенно не держится в нем;4) Заряд, действительно, некорректно отображает. Но это не беда. Досадно для меня то, что каждый день все-таки приходится заряжать, а брала то я его из-за емкой батареи. Интенсивность эксплуатации: в день до 5 звонков, несколько смсок, переписки вибер, вк, иногда музыку слушаю. Вроде ничего криминального, чтобы так разряжаться);5) Бывает зависает ни с того, ни с сего, лечу разбиранием, начинает тормозить и тупить при 8% заряда и ниже, ну, это и понятно);6) Камера...По-моему, это не 8Мп, был у меня Сони Эрикссон до него, кнопочный, там камера 5Мп. Так вот, сонька делает фотки однозначно лучше! 7) По сравнению с вышеупомянутым сонькой (Sony Ericsson Elm) этот телефон гораздо крупнее, массивнее, тяжелее, рука не сразу к нему привыкла. Раньше мне было очень удобно держа телефон в левой руке набирать текст большим пальцем, таким образом, вторая рука была абсолютно свободна. А вот с Престижио не всегда можно управиться одной рукой)).Больше не могу вспомнить, к чему бы придраться) Телефон, в целом,  мне нравится.",4
"Очень неплохой смарт,китаец поживший недолго в Европе,шустрый,непритязательный,в руке удобен,камера конечно не 8Мп,,но фото при свете норм.,В общем за эти деньги очень неплохой гаджет...",5
"Если б знала  все о нем как есть - дождалась бы НТС бюджетного какого-нибудь или Филлипс, или  Тексет в противоударном корпусе.",2
"Телефон со своими не малыми недостатками больше удивил чем огорчил! А все потому, что на яндекса.маркете прочитал перед покупкой о нем отзывы, взвесил все недостатки, преимущества и цену! Как раз купил по хорошей акции с карточкой на 16 гиг в подарок. Поэтому к недостаткам уже был готов, а самые большие это что отсутствует датчик плавного поворота (для игр гонок нужна) и очень плохая камера. К слову камера со своими большими цифрами действительно очень плачевная оказалась. Но меня предупреждали:)А самое, что замечательное, меня порадовало качество сборки этой фирмы. Все на высшем уровне. Использую уже два месяца. Телефон ношу без чехла и пленки. Пыли под экраном пока не обнаружил. Несколько раз ронял на линолиум, даже не перегружался. А недавно так вообще упал в стальную ванну, и слегка намок. Все работало кроме внутреннего динамика, уже расстроился из-за того что придется нести в сервис, выяснять и чето делать. Но к вечеру как телефон обсох, снова заработал динамик! На телефоне нету трещин, ни сколов. Остальное все что нужно в телефоне за такую цену есть, и не нужно за него труситься чтобы его не поломать. Всеравно через год, полтора прийдут новые технологии, новый андроид и нужно будет апгрейдить.Вердикт: Если телефон еще не подешевеет, то лучше присмотреться на более новые модели фирмы Prestigio, с новым android 4.2А сам буду присматривать планшет этой же фирмы.",4
"Пользуюсь уже 4 месяца. Сама сомневалась брать или не брать, рискнула и осталась довольна. Телефон очень хорош для постоянного использования, а для тех кто недоволен акселерометром в играх, покупайте планшеты и рубайтесь на них. При использовании телефона этот автоповорот совершенно не нужен. Как телефон от мало известно фирмы, да за такую цену, само то! Если подумываете о нем, берите, не пожалеете",5
"Очень долго читал отзывы много разных мнений о данном телефоне. Понял одно, что в основном пишут заинтересованные в продаже данного телефона люди. Пользовался планшетом данной фирмы и решил опробовать телефон той же фирмы. Больших претензий нет, батарея реально держит часов 5 если не звонить и не трогать его хватает на сутки и более камера на заявленные 8мп не тянет, приложения ложатся на данный телефон  нормально плохо работает акселератор для эффектных игр большой минус.Добавил карту памяти на 8 проблем нет.Симки 2 шт. работают нормально. Тому кто нуждается для работы в нормальном телефоне либо для знакомства с телефонами на базе андроид берите.",3
"Соотношение цена - качество, функционал просто лучшее на рынке андройдов.   Альтернатив пожалуй нет. Удобно пользоваться, хороший отклик. Это мой первый смартфон на анд. и я приятно удивлен. Если бы не косяк с отображением заряда батареи то был бы идеален. Кто сомневаеться и недостатки для вас не критичны, смело берите не пожалеете. С первой зарядки, активный серф, закачки и игра в игры , звонки и смс, будильник и использование камеры продержался 4 суток. На играх типа миньонов сильно ест батарею, но я не любитель таких игр.",4
"Мой первый смарт. Первое, что мне понравилось вес, ощутим в руке. Задняя крышечка рифленая с прикольным логотипом. Взял в замену простой звонилки, не убиваемой и с без конечным зарядом батарейкой LG GX200, так как периодически нужен интернет и камера  . В первые дни пользования разочаровал аккумулятор. Жрет прям на глазах и не адекватно показывал % заряда . Немного побаловался с разрядкой и зарядкой и установил прогу Battery doctor, вроде пока норм. И зарядки уже хватает теперь на два  дня с периодическим выходом в инет и звонками. Пишут не поддерживает билаин-интерне. Надо включить мозги и поставить галочку в настройках интернета  Тип аутентификации: поставить точку на РАР и 3G ваше. Остальные настройки не трогать. Качество фото с него меня устраивает (это телефон, а не фотоаппарат). Звук громкий. Увеличить можно прогой (без надобности и так хватает). В общем стал привыкать к смарту и просто званилку уже не хочу. Держал бы батарею как моя лыжа, но......... все таки смарт. Когда покупал искал золотую середину  между дорогими и не дорогими смартами и нашел, в виде Prestigio MultiPhone 4055 DUO. Купил сибе и жине, пока довольны. У меня и навигатор в машине этой фирмы, второй год пошел, полет нормальный.",5
"Неплохой аппарат. всё заявленное работает. Единственное, что туговат. Андрид долго мыслит. может это из-за 1гбОЗУ (которая на постой занята и требует освобождения места от устаревших файлов) Громкий аппрат. весь функционал что надо есть. Еле нашла как на каждого пользователя свою мелодию и картинку ставить. немного нехватает синхронизации симки и аппарата. из-за этого, 100раз повторяется один и тот же номер. Копировать надо на аппарат и сохранять там картинки и мелодии -иначе не установить. 2-е симки ловит без проблем. Вай-Фая супер! лёгок в использовании. Хотелось бы, лишь чтоб в мыслях своих был пошустрее.",4
"Нормальный добротный телефон на андроиде. Немного толстоват.Батарея обычная, держит полтора-два дня, при среднем использовании.Камера обычная, ничего выдающегося.",3
"Мой первый смартфон. Требования при выборе были следующие: 1) ёмкость батарейки от 2500 мА, 2) wi-fi, 3) Android, 4) диагональ экрана от 4 дюймов, 5) 2 симки, 6) фронтальная камера, 7) цена 5-6 тысяч. Из выданных Яндекс.маркет вариантов и предварительно просмотренных их отзывов и обзоров, остановился на 3: Fly Energy 2, Fly 440 Energy, Prestigio 4055 DUO. Посмотрел все 3 в магазине, Fly Energy 2 не понравился из-за слишком большого размера, хотя батарейка хорошая. Fly 440 Energy и Prestigio 4055 DUO практически одинаковы, и по виду и по параметрам. Но Prestigio 4055 DUO больше понравился, плюс наличие чехла сыграло свою роль.Первая зарядка от 0 до 100% заняла 7 часов, батарейки хватило на 1 день 15 часов, 2 зарядка заняла 6 часов батарейки хватило на 1 день 19 часов, при постоянным использование телефона, пока тестировал его. После третьей зарядки хватило на 4 дня 12 часов, при обычном режиме использования, то есть звонки, sms, фотографирование и видео запись и интернет через вайфай.Дописываю отзыв спустя 6 месяцев использования, смартфон стал глючить, зависает иногда, решается только вытаскиванием батарейки, еще часто когда нажимаешь список контактов он начинает долго грузиться, более 5 минут, после перезагрузки телефон работает. Блютуз с автомобильным блютузом соединяется и держит отлично, Wi-Fi стабильно работает, фото и видео хорошие, неплохие панорамы делает, батарейка держит пару дней уверенно.Главный минус это зависания и долгая загрузка контактов в самый неподходящий момент, поэтому все же не буду рекомендовать этот смарт покупать.",3
"Замечательный телефон.Пользуюсь 3 года уже никак не нарадуюсь.Столько всего пережил...За такую цену берите,не задумывайтесь",5
Телефон класный держит долго вобше самый успешный телефон за мои покупки.Стоить должен больше,5
"Пережил многое, 2 потопления, кучу падений на различные материалы, при этом жив!",5
В общем вполне неплохой телефон - акк держит нормально ( я не сижу в интернете и не  играю) по работе говорю не мало - на разговоры и смс в хорошем использовании акка хватает на несколько дней. Если берет ребенок и играет в игры - хватает на день - два. Очень порадовал чехол в комплекте! не пришлось подбирать специально и тратить деньги.... Только размер чехла маловат малость.... трудно вытащить! - если руки влажные (вспотели к примеру) - вообще не могла вытащить.... со временем не разносился....,4
"Поддерживает две симки - очень удобно, можно для работы и для себя иметь два отдельных номера, ну и тарифы подбирать соответствующие. экран 4 дюйма в диагонали, небольшой, но и не мелкий, в руках лежит удобно, к тому же приятное рифленое покрытие сзади - не скользит, отпечатки пальцев не так видны. Неплохая камера - 8 мпикс, не супер-крутая, но все равно снимки нормальные, при переносе на комп качество сильно не теряется. Аккумулятор довольно мощный, каждый день заряжать не нужно.",5
"На 2 день использования завис ,вынимал и вставлял акум. 2 раза и только на второй раз помогло",4
"за такую цену аппарат, очень хорош, все устраивает, аккумулятор держит хорошо даже при активном пользовании интернетом и частыми звонками. В игры особо не играю, так что про них говорить ничего не буду. Аппарат очень нравится",5
в принципе баян не плохой если вам нужна болталка с набором офис+интернет,5
"Купил несколько дней назад, лучше бы взял что то другое. Аккумулятор держит заряд буквально часов 12, это, если с него не звонить. Через пол часа разговора заряда осталось 60%, а я его только с зарядки снял. Заряжал первый раз так, как сказали в магазине - 12 часов после полной разрядки. Отключил от зарядки утром, пока доехал до работы осталось 85 %, хотя ни куда не звонил. Все службы отключены, такие как gps, wi-fi, и так далее. Вот так вот. А брал я его только из за того, что аккумулятор 2500 ма/ч...   Не рекомендую покупать.",2
"Все достоинства Prestijo 4055 рассматривайте через его цену. Телефон умеет всё, что должен уметь, но немножко хуже, чем дорогие модели-флагманы. Если вы согласны иметь телефон, который во всём немножечко хуже, чем дорогие модели, но нааамного дешевле их, то Prestijo 4055 - наилучший выбор.",4
"Покупкой полностью доволен, аппарат устраивает на все 100%, решил не переплачивать деньги за бренд, и не жалею.",5
Отличный смарт .,4
"Телефон так себе,очень часто тормозит - нажимаю ""вход в меню"" и жду еще 20-30 сек.,пока он откроет и так практически со всеми приложениями,коих у меня не так много.Один раз слетала прошивка,пришлось менять(при этом потерялись все контакты),иногда зависает.Это основные недостатки.Батарея держит заряд около 3-х дней(если не пользоваться интернетом).",2
Хороший телефон правда есть минус акселерометр помойму вообще никакой не реагирует кобудто его там и нету Камера хорошая наушники очень даже хороши получше чем сенхайзер и монстер-битс (это мое мнение) А чехол отстойный очень трудно вытащить  фронтальная камера обычная Звук тоесть когда записываешь на диктофон или на камеру видео звук очень чистый и кажется что ты держишь айфон Разочаровал только акселерометр а так компания делает хорошие телефоны и планшеты рекомендую покупать!,5
"Сразу хотел взять Sony Xperia Miro,но когда увидел  Prestigio,я понял что я буду переплачивать за бренд,а не за функционал.Хорошая модель,за свои деньги.Сверх возможностей я от него не ждал.Престижио отлично справляется с теми функциями,которыми я пользуюсь(игры,интернет,звонки,камера).У данного смарта,даже нет намека на бюджетность.В данной ценовой категории я ничего лучшего не нашел.",5
"В принципе телефон не так плох, использую для звонков и интернета, глюков серьезных пока не было, иногда сбрасывает живые обои (из-за  512 мб).ТЕЛЕФОН НЕ ИГРОВОЙ!! так что subway и пасьянс ваши лучшие друзья",4
"Есть нюансы:Акселерометр простейший, не играбелен, если что.Чехол в наличии, но тугой(надо растягивать, например, обмотав телефон журнальной бумагой)Шкала заряда нелинейная, как уже было сказано.Нужен был недорогой смартфон. Также рассматривал Fly IQ441 Radiance (чуть слабее, но с IPS). Решил в пользу prestigio из-за цены (4990)Сейчас ещё раз подумал бы, возможно лучше переплатить.update 25.12.13Лучше было переплатить и взять что-нибудь получше... Сенсор стал тупить чаще, появились зависания. Prestigio пока не тянет по качеству...",3
"вообщем телефон замечательный,особенно за своиденьги",5
"купила неделю назад-последние 3 дня глюканул не на шутку-сенсор не реагировал вообще, выключение и перезагрузка не помогали.это мой рабочий инструмент-играться некогда, пока доехала домой до старого-потеряла время и клиентов...сегодня иду сдавать0отвратительная модель, полный абзац....а другие модели у друзей работают...",1
"Мой первый смарт, пользуюсь около 3х месяцев, не ожидал, что буду спокойно пользоваться на одном заряде 3-4 дня, по этой причине ранее не покупал сенсор с большим экраном, кстати, мобильные разговоры меньше всего садят батарею. Камеру так и не получилось победить, при искусственном освещении муть получается полная, но для фотографий имею зеркальный фотик :). Юзал навигатор, скайп, аську и т.п. - превзошли все мои ожидания, да и вообще, с Wi-Fi работает на ура!  При хорошей яркости и четкости экрана, угол обзора не большой, гораздо хуже флаев, лж, самсунг, штс, но мне это даже нравится, ибо нефиг заглядывать в мой экран кому-либо, кроме меня :)",4
